{
  "@context": "https://schema.org",
  "@type": "ItemList",
  "name": "Site Icons",
  "description": "SVG icon definitions for use across the site. All icons are Heroicons outline style (24x24, stroke-width 2).",
  "itemListElement": [
    {
      "@type": "ImageObject",
      "identifier": "scale",
      "name": "Scale",
      "description": "Balance scale - Laws, legal frameworks",
      "source": "heroicons",
      "style": "outline",
      "viewBox": "0 0 24 24",
      "strokeWidth": "2",
      "paths": [
        { "d": "M3 6l3 1m0 0l-3 9a5.002 5.002 0 006.001 0M6 7l3 9M6 7l6-2m6 2l3-1m-3 1l-3 9a5.002 5.002 0 006.001 0M18 7l3 9m-3-9l-6-2m0-2v2m0 16V5m0 16H9m3 0h3" }
      ]
    },
    {
      "@type": "ImageObject",
      "identifier": "book",
      "name": "Book",
      "description": "Open book - Publications, documentation",
      "source": "heroicons",
      "style": "outline",
      "viewBox": "0 0 24 24",
      "strokeWidth": "2",
      "paths": [
        { "d": "M12 6.253v13m0-13C10.832 5.477 9.246 5 7.5 5S4.168 5.477 3 6.253v13C4.168 18.477 5.754 18 7.5 18s3.332.477 4.5 1.253m0-13C13.168 5.477 14.754 5 16.5 5c1.747 0 3.332.477 4.5 1.253v13C19.832 18.477 18.247 18 16.5 18c-1.746 0-3.332.477-4.5 1.253" }
      ]
    },
    {
      "@type": "ImageObject",
      "identifier": "pencil",
      "name": "Pencil",
      "description": "Pencil on paper - Blog, writing, editing",
      "source": "heroicons",
      "style": "outline",
      "viewBox": "0 0 24 24",
      "strokeWidth": "2",
      "paths": [
        { "d": "M11 5H6a2 2 0 00-2 2v11a2 2 0 002 2h11a2 2 0 002-2v-5m-1.414-9.414a2 2 0 112.828 2.828L11.828 15H9v-2.828l8.586-8.586z" }
      ]
    },
    {
      "@type": "ImageObject",
      "identifier": "computer",
      "name": "Computer",
      "description": "Desktop monitor - Software, applications",
      "source": "heroicons",
      "style": "outline",
      "viewBox": "0 0 24 24",
      "strokeWidth": "2",
      "paths": [
        { "d": "M9.75 17L9 20l-1 1h8l-1-1-.75-3M3 13h18M5 17h14a2 2 0 002-2V5a2 2 0 00-2-2H5a2 2 0 00-2 2v10a2 2 0 002 2z" }
      ]
    },
    {
      "@type": "ImageObject",
      "identifier": "server",
      "name": "Server",
      "description": "Server rack - Datacenters, infrastructure",
      "source": "heroicons",
      "style": "outline",
      "viewBox": "0 0 24 24",
      "strokeWidth": "2",
      "paths": [
        { "d": "M5 12h14M5 12a2 2 0 01-2-2V6a2 2 0 012-2h14a2 2 0 012 2v4a2 2 0 01-2 2M5 12a2 2 0 00-2 2v4a2 2 0 002 2h14a2 2 0 002-2v-4a2 2 0 00-2-2m-2-4h.01M17 16h.01" }
      ]
    },
    {
      "@type": "ImageObject",
      "identifier": "flag",
      "name": "Flag",
      "description": "Flag - Jurisdictions, countries, public sector",
      "source": "heroicons",
      "style": "outline",
      "viewBox": "0 0 24 24",
      "strokeWidth": "2",
      "paths": [
        { "d": "M3 21v-4m0 0V5a2 2 0 012-2h6.5l1 1H21l-3 6 3 6h-8.5l-1-1H5a2 2 0 00-2 2zm9-13.5V9" }
      ]
    },
    {
      "@type": "ImageObject",
      "identifier": "calendar",
      "name": "Calendar",
      "description": "Calendar - Events, dates, scheduling",
      "source": "heroicons",
      "style": "outline",
      "viewBox": "0 0 24 24",
      "strokeWidth": "2",
      "paths": [
        { "d": "M8 7V3m8 4V3m-9 8h10M5 21h14a2 2 0 002-2V7a2 2 0 00-2-2H5a2 2 0 00-2 2v12a2 2 0 002 2z" }
      ]
    },
    {
      "@type": "ImageObject",
      "identifier": "globe",
      "name": "Globe",
      "description": "Globe with meridians - International, countries, networks",
      "source": "heroicons",
      "style": "outline",
      "viewBox": "0 0 24 24",
      "strokeWidth": "2",
      "paths": [
        { "d": "M21 12a9 9 0 01-9 9m9-9a9 9 0 00-9-9m9 9H3m9 9a9 9 0 01-9-9m9 9c1.657 0 3-4.03 3-9s-1.343-9-3-9m0 18c-1.657 0-3-4.03-3-9s1.343-9 3-9m-9 9a9 9 0 019-9" }
      ]
    },
    {
      "@type": "ImageObject",
      "identifier": "user",
      "name": "User",
      "description": "User silhouette - Personas, profiles, consumers",
      "source": "heroicons",
      "style": "outline",
      "viewBox": "0 0 24 24",
      "strokeWidth": "2",
      "paths": [
        { "d": "M16 7a4 4 0 11-8 0 4 4 0 018 0zM12 14a7 7 0 00-7 7h14a7 7 0 00-7-7z" }
      ]
    },
    {
      "@type": "ImageObject",
      "identifier": "bolt",
      "name": "Bolt",
      "description": "Lightning bolt - Submarine cables, energy, fast",
      "source": "heroicons",
      "style": "outline",
      "viewBox": "0 0 24 24",
      "strokeWidth": "2",
      "paths": [
        { "d": "M13 10V3L4 14h7v7l9-11h-7z" }
      ]
    },
    {
      "@type": "ImageObject",
      "identifier": "link",
      "name": "Link",
      "description": "Chain link - Networks, connections, related items",
      "source": "heroicons",
      "style": "outline",
      "viewBox": "0 0 24 24",
      "strokeWidth": "2",
      "paths": [
        { "d": "M13.828 10.172a4 4 0 00-5.656 0l-4 4a4 4 0 105.656 5.656l1.102-1.101m-.758-4.899a4 4 0 005.656 0l4-4a4 4 0 00-5.656-5.656l-1.1 1.1" }
      ]
    },
    {
      "@type": "ImageObject",
      "identifier": "shield",
      "name": "Shield",
      "description": "Shield with checkmark - Privacy, security, data protection",
      "source": "heroicons",
      "style": "outline",
      "viewBox": "0 0 24 24",
      "strokeWidth": "2",
      "paths": [
        { "d": "M9 12l2 2 4-4m5.618-4.016A11.955 11.955 0 0112 2.944a11.955 11.955 0 01-8.618 3.04A12.02 12.02 0 003 9c0 5.591 3.824 10.29 9 11.622 5.176-1.332 9-6.03 9-11.622 0-1.042-.133-2.052-.382-3.016z" }
      ]
    },
    {
      "@type": "ImageObject",
      "identifier": "lock-open",
      "name": "Lock Open",
      "description": "Unlocked padlock - Access, open data",
      "source": "heroicons",
      "style": "outline",
      "viewBox": "0 0 24 24",
      "strokeWidth": "2",
      "paths": [
        { "d": "M8 11V7a4 4 0 118 0m-4 8v2m-6 4h12a2 2 0 002-2v-6a2 2 0 00-2-2H6a2 2 0 00-2 2v6a2 2 0 002 2z" }
      ]
    },
    {
      "@type": "ImageObject",
      "identifier": "eye",
      "name": "Eye",
      "description": "Eye - Surveillance, visibility, government access",
      "source": "heroicons",
      "style": "outline",
      "viewBox": "0 0 24 24",
      "strokeWidth": "2",
      "paths": [
        { "d": "M15 12a3 3 0 11-6 0 3 3 0 016 0z" },
        { "d": "M2.458 12C3.732 7.943 7.523 5 12 5c4.478 0 8.268 2.943 9.542 7-1.274 4.057-5.064 7-9.542 7-4.477 0-8.268-2.943-9.542-7z" }
      ]
    },
    {
      "@type": "ImageObject",
      "identifier": "location",
      "name": "Location",
      "description": "Map marker - Localization, geography",
      "source": "heroicons",
      "style": "outline",
      "viewBox": "0 0 24 24",
      "strokeWidth": "2",
      "paths": [
        { "d": "M17.657 16.657L13.414 20.9a1.998 1.998 0 01-2.827 0l-4.244-4.243a8 8 0 1111.314 0z" },
        { "d": "M15 11a3 3 0 11-6 0 3 3 0 016 0z" }
      ]
    },
    {
      "@type": "ImageObject",
      "identifier": "lock",
      "name": "Lock",
      "description": "Locked padlock - Security, cybersecurity, encryption",
      "source": "heroicons",
      "style": "outline",
      "viewBox": "0 0 24 24",
      "strokeWidth": "2",
      "paths": [
        { "d": "M12 15v2m-6 4h12a2 2 0 002-2v-6a2 2 0 00-2-2H6a2 2 0 00-2 2v6a2 2 0 002 2zm10-10V7a4 4 0 00-8 0v4h8z" }
      ]
    },
    {
      "@type": "ImageObject",
      "identifier": "clipboard",
      "name": "Clipboard",
      "description": "Clipboard with list - Sectors, checklists",
      "source": "heroicons",
      "style": "outline",
      "viewBox": "0 0 24 24",
      "strokeWidth": "2",
      "paths": [
        { "d": "M9 5H7a2 2 0 00-2 2v12a2 2 0 002 2h10a2 2 0 002-2V7a2 2 0 00-2-2h-2M9 5a2 2 0 002 2h2a2 2 0 002-2M9 5a2 2 0 012-2h2a2 2 0 012 2m-3 7h3m-3 4h3m-6-4h.01M9 16h.01" }
      ]
    },
    {
      "@type": "ImageObject",
      "identifier": "users",
      "name": "Users",
      "description": "User group - Organizers, teams, communities",
      "source": "heroicons",
      "style": "outline",
      "viewBox": "0 0 24 24",
      "strokeWidth": "2",
      "paths": [
        { "d": "M17 20h5v-2a3 3 0 00-5.356-1.857M17 20H7m10 0v-2c0-.656-.126-1.283-.356-1.857M7 20H2v-2a3 3 0 015.356-1.857M7 20v-2c0-.656.126-1.283.356-1.857m0 0a5.002 5.002 0 019.288 0M15 7a3 3 0 11-6 0 3 3 0 016 0zm6 3a2 2 0 11-4 0 2 2 0 014 0zM7 10a2 2 0 11-4 0 2 2 0 014 0z" }
      ]
    },
    {
      "@type": "ImageObject",
      "identifier": "clock",
      "name": "Clock",
      "description": "Clock face - Time, duration, schedules",
      "source": "heroicons",
      "style": "outline",
      "viewBox": "0 0 24 24",
      "strokeWidth": "2",
      "paths": [
        { "d": "M12 8v4l3 3m6-3a9 9 0 11-18 0 9 9 0 0118 0z" }
      ]
    },
    {
      "@type": "ImageObject",
      "identifier": "search",
      "name": "Search",
      "description": "Magnifying glass - Search, discovery",
      "source": "heroicons",
      "style": "outline",
      "viewBox": "0 0 24 24",
      "strokeWidth": "2",
      "paths": [
        { "d": "M21 21l-6-6m2-5a7 7 0 11-14 0 7 7 0 0114 0z" }
      ]
    },
    {
      "@type": "ImageObject",
      "identifier": "info",
      "name": "Info",
      "description": "Information circle - Help, details",
      "source": "heroicons",
      "style": "outline",
      "viewBox": "0 0 24 24",
      "strokeWidth": "2",
      "paths": [
        { "d": "M13 16h-1v-4h-1m1-4h.01M21 12a9 9 0 11-18 0 9 9 0 0118 0z" }
      ]
    },
    {
      "@type": "ImageObject",
      "identifier": "warning",
      "name": "Warning",
      "description": "Exclamation triangle - Warnings, alerts, caution",
      "source": "heroicons",
      "style": "outline",
      "viewBox": "0 0 24 24",
      "strokeWidth": "2",
      "paths": [
        { "d": "M12 9v2m0 4h.01m-6.938 4h13.856c1.54 0 2.502-1.667 1.732-3L13.732 4c-.77-1.333-2.694-1.333-3.464 0L3.34 16c-.77 1.333.192 3 1.732 3z" }
      ]
    },
    {